{"$schema":"https://json-schema.org/draft/2020-12/schema","$id":"https://aitranslatenovel9527.local/schemas/translation-job.schema.json","title":"TranslationJob target contract","type":"object","required":["id","revision","status","workerId","leaseUntil","lastHeartbeatAt","lastError","recoveryReason","segments"],"properties":{"id":{"type":"string"},"revision":{"type":"integer","minimum":0},"status":{"enum":["pending","running","completed","failed","cancelled"]},"workerId":{"type":["string","null"]},"leaseUntil":{"type":["string","null"],"format":"date-time"},"lastHeartbeatAt":{"type":["string","null"],"format":"date-time"},"lastError":{"type":"string"},"recoveryReason":{"type":"string"},"segments":{"type":"array","items":{"type":"object","required":["id","status","attempts","requestId","startedAt","finishedAt","lastError","translatedText","issues"],"properties":{"id":{"type":"string"},"status":{"enum":["pending","translating","completed","failed","cancelled"]},"attempts":{"type":"integer","minimum":0},"requestId":{"type":["string","null"]},"startedAt":{"type":["string","null"],"format":"date-time"},"finishedAt":{"type":["string","null"],"format":"date-time"},"lastError":{"type":"string"},"translatedText":{"type":"string"},"issues":{"type":"array"}}}}}}
